"src","tgt"
"A man throwing or retrieving a line thrown into the water at the dock of a large boat .","Ein Mann , der ein Seil , das am Dock eines großen Boots ins Wasser geworfen wird , wirft oder herausholt ."
"A muddy jeep driving through the forest .","Ein verdreckter Jeep , der durch den Wald fährt ."
"A man walks toward a garage , on a poorly lit road .","Ein Mann geht auf einer schlecht beleuchteten Straße auf eine Tankstelle zu ."
"A mother and daughter standing in front of a graffiti covered wall .","Mutter und Tochter stehen vor einer von Graffitis bedeckten Mauer ."
"A fluffy white dog looks down a steep , grassy embankment .","Ein flauschiger weißer Hund blickt einen steilen , grasbewachsenen Damm hinunter ."
"A large boat drives through the harbor .","Ein großes Boot fährt durch den Hafen ."
"Two babies are asleep in messy highchairs in front of CD shelves .","Zwei Babys schlafen in verschmierten Hochstühlen vor CD @-@ Regalen ."
"A falcon is perched on a girl 's left arm as a man assists her and talks into a microphone .","Ein Falke sitzt auf dem linken Arm eines Mädchens , während ein Mann ihr hilft und in ein Mikrofon spricht ."
"Two soccer teams converge at the goal and the goalie reaches for the ball .","Zwei Fußballteams kommen am Tor zusammen und der Torwart fasst nach dem Ball ."
"The child in the red jacket and orange mittens is sitting in the snow next to a shovel .","Das Kind mit der roten Jacke und den orangefarbenen Handschuhen sitzt neben einer Schaufel im Schnee ."
"A group of people sit down at a table for a meal .","Eine Personengruppe sitzt zu einer Mahlzeit am Tisch ."
"A woman sitting on the side of the rode selling bananas .","Eine Frau , die am Straßenrand sitzt und Bananen verkauft ."
"2 men are sitting down and drawing on either side of an easel in a room with a Christmas Tree .","2 Männer in einem Raum mit einem Weihnachtsbaum sitzen auf beiden Seiten einer Staffelei und zeichnen ."
"There are people feeding sheep and a dog is herding them .","Personen , die Schafe füttern , und ein Hund , der sie zusammentreibt ."
"Five women in identical swimsuits hold on to a rope near the ocean .","Fünf Frauen in gleichen Badeanzügen halten nahe am Meer ein Seil ."
"A brown dog is sitting in the front of a canoe .","Ein brauner Hund sitzt vor einem Kanu ."
"A brown and black dog leaps through the freshly mown grass .","Ein braun @-@ schwarzer Hund springt durch das frisch gemähte Gras ."
"An old man wearing glasses is praying with his beads while sitting down .","Ein alter Mann mit Brille betet mit seinen Perlen im Sitzen ."
"People hanging out on the beach in bathing suits and relaxing clothing .","Leute hängen in Badeanzügen und Freizeitkleidung am Strand herum ."
"A multi generation family having a meal at a restaurant .","Eine Familie mit mehreren Generationen , die in einem Restaurant eine Mahlzeit einnimmt ."
"There are several women , some wearing T @-@ shirts with HSBC on them , at a food buffet .","Mehrere Frauen an einem Essensbuffet , von denen einige T @-@ Shirts mit der Aufschrift HSBC tragen ."
"Young girl hugging her red teddy bear .","Ein Mädchen , das seinen roten Teddybär umarmt ."
"Multiple children in bright colors are playing a game of musical chairs .","Mehrere Kinder in leuchtende Farben spielen die Reise nach Jerusalem ."
"A nice neighborhood street in the beautiful green foothills .","Eine Straße in einer besseren Gegend in den schönen grünen Hügeln des Vorgebirges ."
"White fluffy dog hangs out of the window of a turquoise building .","Ein weißer flauschiger Hund hängt aus dem Fenster eines türkisfarbenen Gebäudes ."
"The dog is running in the grass next to the water .","Der Hund rennt im Gras neben dem Wasser ."
"A blond dog with floppy ears runs toward the camera .","Ein heller Hund mit Hängeohren rennt auf die Kamera zu ."
"A man holding a plastic bag is standing in a doorway .","Ein Mann mit einer Plastiktüte steht in einer Toreinfahrt ."
"Four people stand around near a blue fork lift .","Vier Personen stehen um einen blauen Gabelstapler herum ."
"A girls brown hair is thrashed by the wind .","Das braune Haar eines Mädchens wird vom Wind zerzaust ."
"A man with a striped shirt is on stage next to another person with a guitar .","Ein Mann mit gestreiftem Hemd ist auf der Bühne neben einer anderen Person mit einer Gitarre ."
"A soccer player dressed in blue holding a soccer ball preparing to throw it .","Ein blau gekleideter Fußballspieler , der einen Fußball hält , um ihn zu werden ."
"A man wearing glasses plays a large brass instrument","Ein Mann mit Brille spielt ein großes Bassinstrument ."
"A little girl peers out from a woven basket .","Ein kleines Mädchen blickt aus einem geflochtenen Korb heraus ."
"Pigeon staring at a woman in black boots sitting on a park bench reading a paper .","Eine Taube starrt eine Frau mit schwarzen Stiefeln an , die auf einer Parkbank liest und die Zeitung liest ."
"A little girl is sweeping a patio with a broom that is bigger than she is .","Ein kleines Mädchen kehrt eine Veranda mit einem Besen , der größer ist als sie selbst ."
"The man standing on the beam is wearing a white hard hat .","Der Mann , der auf dem Balken steht , trägt einen weißen Schutzhelm ."
"City performer , male , all dressed in black with cowboy hat playing guitar .","Ein männlicher Straßenkünstler , der ganz in Schwarz gekleidet ist , einen Cowboyhut trägt und Gitarre spielt ."
"Construction worker on a beam helping guide the crane to place another beam in the right position .","Bauarbeiter auf einem Balken , die dabei helfen , den Kran so zu führen , dass ein anderer Balken an der richtigen Stelle platziert wird ."
"Man in blue sweater measuring curved board .","Ein Mann mit blauem Pullover , der ein gebogenes Brett misst ."
"A man walking in the side street with his head down .","Ein Mann , der mit gesenktem Kopf in einer Seitenstraße geht ."
"Man on a beach with a baby","Ein Mann am Strand mit einem Baby"
"A smiling man with short brown hair in a black shirt with an open orange shoe box .","Ein lächelnder Mann mit kurzen braunen Haaren und schwarzem Hemd mit einem offenen orangefarbenen Schuhkarton ."
"A lady is taking care of her child .","Eine Dame betreut ihr Kind ."
"Two men acting out a scene in front of a small group of friends .","Zwei Männer spielen vor einer kleinen Freundesgruppe eine Szene ."
"A woman wears an Egytian @-@ like headdress .","Eine Frau trägt eine Kopfbedeckung , die wie etwas Ägyptisches aussieht ."
"Two young girls and an old man with gray hair and beard are opening Christmas presents .","Zwei Mädchen und ein alter Mann mit grauen Haaren und Bart packen Weihnachtsgeschenke aus ."
"Older woman in red sweeter is opening a gift .","Eine ältere Frau in einem roten Pullover öffnet ein Geschenk ."
"A brown dog is laying on its back on a white carpet with a green ball on it .","Ein brauner Hund liegt auf dem Rücken auf einem weißen Teppich mit einem grünen Ball ."
"One person is looking at a painting while another person is holding her hand up .","Eine Person blickt auf ein Gemälde , und eine andere Person hält ihre Hand hoch ."
"A hummer is driving through a mud puddle several feet deep .","Ein Prachtskerl fährt durch eine schlammige Pfütze , die mindestens einen halben Meter tief ist ."
"A woman in a black shirt is cuddling a cat .","Eine Frau mit schwarzem Oberteil knuddelt eine Katze ."
"The lady is white is selling things on the street .","Die weiß gekleidete Dame verkauft Sachen auf einer Straße ."
"A dog and a cow are standing on a hillside .","Ein Hund und eine Kuh stehen auf einem Hügel ."
"Two young boys swimming in a pool of green water .","Zwei Jungen schwimmen in einem Teich mit grünem Wasser ."
"Two males are staring at a floating object .","Zwei männliche Personen starrend auf ein schwimmendes Objekt ."
"A woman sites with her feet on the seats in a subway car .","Eine Frau sitzt in einem U @-@ Bahn @-@ Wagen und hat die Beine auf die Sitze gelegt ."
"Men playing with a red ring out in the field .","Männer , die draußen im Feld mit einem roten Ring spielen ."
"A boy running on a beach looking out at a city .","Ein Junge rennt an einem Strand mit Blick auf eine Stadt ."
"A man in black shorts is sliding on a tarp .","Ein Mann in schwarzen Shorts rutscht auf einer Abdeckplane ."
"A young boy in a swimsuit and sandals is standing in a doorway .","Ein Junge in Badehose und Sandalen steht in einer Toreinfahrt ."
"Two kids are out in a small boat in the ocean with a larger boat in the background .","Zwei Kinder sind in einem kleinen Boot draußen auf dem Meer , im Hintergrund ist ein größeres Boot zu sehen ."
"People are walking along the sidewalks of a brightly lit city .","Leute gehen auf den Bürgersteigen einer hell erleuchteten Stadt ."
"A group of people are playing instruments .","Eine aus mehreren Personen bestehende Gruppe spielt Instrumente ."
"An Asian woman in a black and white printed shirt sits by the side of a building .","Eine asiatische Frau in einem schwarz @-@ weiß bedruckten Oberteil sitzt neben einem Gebäude ."
"A group of men dressed in Santa attired play music on a street corner .","Eine Gruppe von Männer in Weihnachtsmannkostümen macht an einer Straßenecke Musik ."
"A girl wearing a halter top eats cake at a table .","Ein Mädchen mit einem Bustier isst an einem Tisch Kuchen ."
"Construction worker leaning against under a crosswalk light .","Ein Bauarbeiter der sich gegen eine Ampel lehnt ."
"A person is a red hat and winter jacket is looking into the distance .","Eine Person mit roter Mütze und Winterjacke blickt in die Ferne ."
"A man of African descent stands atop a beam .","Ein Mann afrikanischer Herkunft steht auf einem Balken ."
"A crowd of suburban youth wait for a performance to begin .","Eine aus Jugendlichen aus den Vorstädten bestehende Menschenmenge wartet auf den Beginn einer Vorstellung ."
"A person is standing on a ladder , hanging wallpaper .","Eine Person steht auf einer Leiter und hängt Tapete ."
"A few people park their boat at a dock .","Ein paar Leute parken ihr Boot an der Anlegestelle ."
"Man sitting in a restaurant at a table .","Ein Mann , der in einem Restaurant am Tisch sitzt ."
"A woman in an orange jersey is holding a football and being pursued by a woman in a blue t @-@ shirt on a field .","Eine Frau auf einem Platz in einem orangefarbenen Trikot hält einen Fußball und wird von einer Frau in einem blauen T @-@ Shirt verfolgt ."
"A man with a backpack on filming something .","Ein Mann mit einem Rucksack auf dem Rücken , der etwas filmt ."
"A black and white dog in a plaid coat is carrying a very long stick .","Ein schwarz @-@ weißer Hund in einer karierten Jacke trägt einen sehr langen Stock ."
"A smiling man standing on two scooters .","Ein lächelnder Mann steht auf zwei Motorrollern ."
"A white dog is airborne whilst catching a green toy .","Ein weißer Hund befindet sich beim Fangen eines grünen Spielzeugs in der Luft ."
"A person with a skateboard is sitting on a bench .","Eine Person sitzt mit einem Skateboard auf einer Bank ."
"The man in blue is punching the man with the red gloves while he blocks his face .","Der blau gekleidete Mann versetzt dem Mann mit den roten Handschuhen einen Faustschlag , während er sein Gesicht schützt ."
"A man in a white shirt eating vegetables .","Ein Mann mit einem weißen Hemd , der Gemüse isst ."
"A woman holding a purse is walking in front of two doors .","Eine Frau , die eine Handtasche hält , geht an zwei Türen vorbei ."
"A small child sleeding down a snowy hill wearing a blue helmet","Ein kleines Kind mit einem blauen Helm , das einen verschneiten Hügel hinunterrutscht ."
"A man plays an acoustic guitar for an audience inside a large yellow and white tent .","Ein Mann spielt für ein Publikum in einem großen gelb @-@ weißen Zelt auf einer akustischen Gitarre ."
"Four Walmart shoppers in a deep discussion in the grocery section .","Vier Walmart @-@ Einkäufer im Lebensmittelbereich , die ins Gespräch vertieft sind ."
"Two people wearing backpacks and a woman in red shorts are standing on some large rock formations .","Zwei Personen mit Rucksäcken und eine Frau mit roten Shorts stehen auf großen Felsformationen ."
"Hikers walking up red clay path .","Wanderer gehen den roten Lehmpfad hoch ."
"A band performing in front of a group of fans .","Eine Band spielt vor einer Gruppe von Fans ."
"A band playing in a pretty small venue .","Eine Band spielt an einem kleinen Veranstaltungsort ."
"A little boy is eating something and got it all over his mouth .","Ein kleiner Junge isst etwas und hat den ganzen Mund damit verschmiert ."
"Band performing at a show .","Eine Band , die bei einer Show auftritt ."
"Two men are singing in front of a small group of men wearing caps .","Zwei Männer sitzen vor einer kleinen Gruppe von Männern mit Mützen ."
"A monk shows visitors one of his possessions .","Ein Mönch zeigt Besuchern eines seiner Besitztümer ."
"A male in his underwear is posing for a picture with two women in Time 's Square .","Eine männliche Person in Unterwäsche posiert auf dem Times Square für ein Bild mit zwei Frauen ."
"Some men are standing by the side of the highway .","Ein paar Männer stehen an der Seite der Autobahn ."
"A person with a red hat stands in a pile of snow on the side of a road while traffic goes by .","Eine Person mit roter Mütze steht in einem Schneehaufen neben einer Straße , während der Verkehr vorbeizieht ."
"A hiker in a red cap walking along a mountain path .","Ein Wanderer mit roter Mütze , der einen Bergpfad entlanggeht ."
"A man in a blue jacket stands on a dirt path in a forest full of trees and ferns .","Ein Mann mit blauer Jacke steht auf einem unbefestigten Pfad in einem Wald voller Bäume und Farn ."
"A dog sitting in ice and snow .","Ein Hund sitzt in Eis und Schnee ."
"A warmly dressed boy pretending an icicle is a gun .","Ein warm angezogener Junge , der so tut , als sei ein Eiszapfen eine Pistole ."
"A young man has fallen asleep outside while resting his head on his backpack .","Ein junger Mann ist draußen mit dem Kopf auf dem Rucksack eingeschlafen ."
"A young child with snow on his face gets out of a blue sled .","Ein Kind mit Schnee im Gesicht steigt aus einem blauen Schlitten aus ."
"Older man with glasses talking on the phone .","Ein älterer Mann mit Brille , der telefoniert ."
"Two men , one dressed in red , white , and blue coat and the other dressed in a dark coat , walk down a cobblestone street .","Zwei Männer , einer rot und weiß gekleidet mit einem blauen Mantel und der andere mit einem dunkleren Mantel , gehen eine gepflasterte Straße entlang ."
"Two men in black jackets walk down the street .","Zwei Männer mit blauen Jacken gehen die Straße entlang ."
"Child in orange jacket and a helmet playing in the snow .","Ein Kind mit einer orangefarbenen Jacke und einem Helm spielt im Schnee ."
"A boy dives into a pool near a water slide .","Ein Junge taucht in der Nähe einer Wasserrutsche in ein Schwimmbecken ."
"A group of people standing on the steps of an old house .","Eine Personengruppe steht auf den Stufen eines alten Hauses ."
"An eccentrically dressed man and his dog are sitting on a bench with a guitar and harmonica .","Ein exzentrisch gekleideter Mann und sein Hund sitzen mit Gitarre und Mundharmonika auf einer Bank ."
"A man playing a trumpet along side a woman playing a saxophone stand outside in pink hats .","Ein Mann , der Trompete spielt , steht neben einer Frau , die Saxophon spielt , im Freien , und beide tragen rosafarbene Hüte ."
"This woman is laying on concrete .","Diese Frau liegt auf Beton ."
"A man with a red sweater with a paper badge looking down at something .","Ein Mann mit einem roten Pullover mit Papierabzeichen blickt auf etwas herab ."
"Four people are on a dock and two of them are sitting on railings .","Vier Personen sind an einer Anlegestelle , und zwei davon sitzen auf Geländern ."
"A boy jumps into a pool while lifeguards watch .","Ein Junge springt in ein Schwimmbecken und Bademeister sehen zu ."
"A large group of people with pamphlets sitting in a auditorium .","Eine große Menschengruppe mit Flugblättern sitzt in einem Hörsaal ."
"A man with a guitar and a cowboy hat performs in front of a microphone .","Ein Mann mit Gitarren und Cowboyhut spielt vor einem Mikrofon ."
"Two country musicians jamming it up .","Zwei Country @-@ Musiker lassen es fetzen ."
"A man at a car lot is holding a pop and waiting for customers .","Ein Mann auf einem Parkplatz hält eine Limo und wartet auf Kunden ."
"Two men work on a bicycle in a garage .","Zwei Männer arbeiten in einer Werkstatt an einem Fahrrad ."
"A woman and a child are outside of a Mcdonald 's and there 's a man seated inside with a drink .","Eine Frau und ein Kind vor McDonalds , und ein Mann , der mit einem Getränk drinnen sitzt ."
"A man watches a young child coloring with her crayola crayons .","Ein Mann beobachtet ein Kind , das mit Crayola @-@ Stiften etwas ausmalt ."
"A little girl in a red shirt playing on a jungle gym .","Ein kleines Mädchen mit rotem Oberteil , das auf einem Klettergerüst spielt ."
"The baby is holding a Santa figurine .","Das Baby hält eine Weihnachtsmannpuppe ."
"Five children , two boys and three girls , with the girls wearing white scarves , sit on the pavement outside in front of a large window .","Fünf Kinder , zwei Jungen und drei Mädchen , sitzen draußen vor einem großen Fenster auf dem Boden , wobei die Mädchen weiße Schals tragen ."
"Christmas time in a city square full of people .","Weihnachtszeit auf einem Platz voller Menschen in der Stadt ."
"A woman in a green vest leans back with her eyes closed and mouth open .","Eine Frau mit grüner Weste lehnt sich mit geschlossenen Augen und geöffnetem Mund zurück ."
"A small child cries as the man in the white shirt holds him .","Ein kleines Kind schreit , während es von einem Mann in weißem Hemd gehalten wird ."
"An adult is holding up a child who is trying to ice skate .","Ein Erwachsener hält ein Kind hoch , das versucht , Eis zu laufen ."
"A man is sitting on a white lawn chair in front of a blue building .","Ein Mann sitzt auf einem weißen Gartenstuhl vor einem blauen Gebäude ."
"Two dogs , one brown , the other black and white , are playing on a sidewalk .","Zwei Hunde , einer braun , der andere schwarz @-@ weiß , spielen auf einem Gehweg ."
"A boy looks at a new toy during christmas","Ein Junge blickt an Weihnachten auf ein neues Spielzeug ."
"Four men walking down the street in all black robes .","Vier Männer in ganz schwarzen Roben gehen die Straße entlang ."
"A child with a yellow balloon walks through a fair .","Ein Kind mit einem gelben Luftballon geht durch einen Jahrmarkt ."
"A man is opening a present and posing with it for a picture .","Ein Mann öffnet ein Geschenk und posiert damit für ein Foto ."
"Man opens gift of beer bottle pillow .","Ein Mann öffnet ein Geschenk , das ein Bierflaschenkissen enthält ."
"A bull rider is trying to stay on a bull at a rodeo .","Ein Bullenreiter bei einem Rodeo versucht auf einem Bullen zu bleiben ."
"The boy is jumping into a lake .","Der Junge springt in einen See ."
"A young woman in a cupcake shirt unwraps a gift .","Eine junge Frau in einem Muffin @-@ Oberteil packt ein Geschenk aus ."
"A girl walks next to a pool .","Ein Mädchen geht neben einem Schwimmbecken ."
"A young woman in a hat poses with a rooster .","Eine junge Frau mit Hut posiert mit einem Hahn ."
"Two young girls enjoying their day at the park with bubbles .","Zwei Mädchen genießen ihren Tag im Park mit Seifenblasen ."
"There is a person sitting on a plastic blow @-@ up float in the high piled snow .","Eine Person sitzt auf einer aufblasbaren Schwimmhilfe in hoch aufgetürmtem Schnee ."
"A person in a blue jacket stands along side crates and kegs on a busy Asian street .","Eine Person mit blauer Jacke steht neben Kisten und kleinen Fässern auf einer belebten Straße in Asien ."
"An old lady wearing apron in her kitchen , smiling while spooning soup to another pan .","Eine alte Dame mit Schürze in der Küche , die lächelt , während sie Suppe in einen anderen Topf schöpft ."
"A girl in a blue bathing suit walks across the beach .","Ein Mädchen mit blauem Badeanzug geht über den Strand ."
"A woman is lying on her stomach on a white pillow and crying .","Eine Frau liegt auf einem weißen Kissen auf dem Bauch und weint ."
"A little boy is throwing snow around outside .","Ein kleiner Junge wirft draußen mit Schnee um sich ."
"A man wearing a black hat and coat makes a face with a crowd behind him .","Ein Mann mit schwarzer Mütze und Mantel zieht eine Grimasse , während hinter ihm eine Menschenmenge steht ."
"Family gazes as newborn sleeps on the lap of the mother .","Eine Familie blickt fasziniert auf ein Neugeborenes , das auf dem Schoß der Mutter schläft ."
"It 's Christmas and its also snowing and there is a person jumping on top of a pole .","Es ist Weihnachten und es schneit , und eine Person springt auf einem Pfosten ."
"A woman and a girl ride a sled down a hill standing up .","Eine Frau und ein Mädchen fahren im Stehen einen Schlitten einen Hügel hinunter ."
"A black dog carries an orange ball , walking on the ground covered in leaves .","Ein schwarzer Hund läuft auf dem laubbedeckten Boden und trägt einen orangefarbenen Ball ."
"A young boy and girl playing Pokemon .","Ein Junge und ein Mädchen spielen Pokemon ."
"Older person standing in the water holding on to a wooden stake .","Eine ältere Person , die im Wasser steht und sich an einem Holzpfahl festhält ."
"An older man and woman are playing monopoly with children .","Ein älterer Mann und eine älter Frau spielen mit den Kindern Monopoly ."
"Two older children hold the hands of a younger child in goggles while jumping into a pool .","Zwei ältere Kinder halten die Hände eines jüngeren Kinds mit Schwimmbrille und springen zusammen in ein Schwimmbecken ."
"A woman and a child are standing next to a chalkboard on an easel .","Eine Frau und ein Kind stehen neben einer Wandtafel auf einem Tafelständer ."
"A man plays an acoustic guitar on a subway platform .","Ein Mann spielt auf einem U @-@ Bahn @-@ Bahnsteig auf einer akustischen Gitarre ."
"A young boy is writing on a chalkboard .","Ein Junge schreibt auf eine Tafel ."
"A little girl is carefully coloring in the pictures of a coloring book .","Ein kleines Mädchen malt sorgfältig die Bilder eines Malbuchs aus ."
"A little girl has a pen sticking out of her nose .","Einem kleinen Mädchen steht ein Stift aus der Nase heraus ."
"A woman in a bridal dress is being walked in with a man in a skirt .","Eine Frau im Brautkleid wird von einem Mann in einem Hemd hereingebracht ."
"Two elderly women setting up dinner .","Zwei ältere Frauen decken den Tisch ."
"Woman in blue dress dancing in front of a crowd .","Eine Frau in einem blauen Kleid , die vor einer Menschenmenge tanzt ."
"A male toddler colors a picture with a green crayon and a dimly @-@ lit restaurant .","Ein männliches Kleinkind malt ein Bild mit einem grünen Stift aus , und ein schlecht beleuchtetes Restaurant ."
"The baby is wearing a bib and sitting in an adult'","Das Baby trägt einen Latz und sitzt einem Erwachsenen auf dem Schoss ."
"Three casually dressed men in a yard smiling .","Drei leger gekleidete Männer in einem Hof , die lächeln ."
"A golden dog is jumping in an attempt to catch a ball .","Ein goldfarbener Hund springt und versucht , um einen Ball zu fangen ."
"Dog jumping looking up and small white ball in air passed by","Der springende Hund blickt nach oben , und ein kleiner weißer Ball fliegt vorbei ."
"A man with glasses replaces a watch battery while another man watches him .","Ein Mann mit Brille tauscht die Batterie einer Uhr aus , während ihm ein anderer Mann zusieht ."
"A young woman and some friends at a party .","Eine junge Frau und ein paar Freunde auf einer Party ."
"A man sitting at a dining table , wearing a striped shirt , is eating a salad and having a glass of red wine .","Ein Mann mit gestreiftem Hemd sitzt am Essenstisch , isst Salat und trinkt ein Glas Rotwein ."
"Woman in yellow costume smiling .","Eine Frau , die lächelt , in einem gelben Kostüm ."
"A woman is reading a piece of paper aloud as a man stands behind her .","Eine Frau liest aus der Zeitung vor , während ein Mann hinter ihr steht ."
"Two men posing for a picture while drinking beer .","Zwei Männer trinken Bier und posieren für ein Bild ."
"Man with glasses holding boy upside down outside in a stone @-@ filled yard .","Ein Mann mit Brille , der einen Jungen draußen in einem mit Hof mit vielen Steinen mit dem Kopf nach unten hält ."
"People at work in the lounge .","Leute , die im Foyer arbeiten ."
"A bunch of guys watching something on a computer screen .","Ein paar Männer , die etwas aus einem Computerbildschirm betrachten ."
"A group of firefighters are gathered in the street .","Eine Gruppe Feuerwehrleute sind auf der Straße versammelt ."
"A woman with luggage walks along a street in front of a large advertisement .","Eine Frau mit Gepäck geht vor einer großen Werbung die Straße entlang ."
"A man holds a dog and a beer while sitting in a floral armchair .","Ein Mann sitzt in einem geblümten Sessel und hält einen Hund und ein Bier ."
"A woman in pajamas and a man smiling in a hallway .","Eine Frau im Schlafanzug und ein lächelnder Mann in einem Flur ."
"Some women are putting candles on a cake made of Marshmallow Peeps .","Ein paar Frauen stecken Kerzen auf einen Kuchen aus Marchmallow Peeps ."
